{"protocol_version":1,"name":"server-setup-base","version":"1.0.0","description":"Desired-state server setup and controlled upgrade operations for ohtools.","commands":[{"path":["setup","check"],"use":"check","short":"Check the selected server setup profile for drift","category":"diagnostic","arguments":[],"flags":[],"requires_root":false,"requires_force":false,"supports_dry_run":false,"requires_confirmation":false},{"path":["setup","apply"],"use":"apply [item...]","short":"Converge all or selected server setup items","category":"runbook","arguments":[{"name":"item","description":"Stable server setup item ID","required":false,"variadic":true}],"flags":[],"requires_root":true,"requires_force":false,"supports_dry_run":true,"requires_confirmation":true},{"path":["setup","upgrade"],"use":"upgrade","short":"Install ordinary package upgrades without rebooting","category":"runbook","arguments":[],"flags":[],"requires_root":true,"requires_force":false,"supports_dry_run":true,"requires_confirmation":true}]}
