{"protocol_version":1,"name":"systemd-base","version":"1.0.1","description":"Systemd service status, logs, and controlled restart operations for ohtools.","commands":[{"path":["service","status"],"use":"status \u003cunit\u003e","short":"Show stable systemd unit properties","category":"diagnostic","arguments":[{"name":"unit","description":"Systemd unit name","required":true,"variadic":false}],"flags":[],"requires_root":false,"requires_force":false,"supports_dry_run":false,"requires_confirmation":false},{"path":["service","logs"],"use":"logs \u003cunit\u003e","short":"Show redacted systemd journal entries","category":"diagnostic","arguments":[{"name":"unit","description":"Systemd unit name","required":true,"variadic":false}],"flags":[{"name":"since","type":"duration","description":"Journal lookback duration","default":"1h0m0s"},{"name":"lines","type":"int","description":"Maximum journal lines","default":200}],"requires_root":false,"requires_force":false,"supports_dry_run":false,"requires_confirmation":false},{"path":["service","restart"],"use":"restart \u003cunit\u003e","short":"Restart and verify a systemd unit","category":"operational","arguments":[{"name":"unit","description":"Systemd unit name","required":true,"variadic":false}],"flags":[],"requires_root":true,"requires_force":false,"supports_dry_run":true,"requires_confirmation":true}]}
