{"protocol_version":1,"name":"storage-base","version":"1.0.1","description":"Filesystem capacity and usage diagnostics for ohtools.","commands":[{"path":["disk","usage"],"use":"usage [path]","short":"Show filesystem usage","category":"diagnostic","arguments":[{"name":"path","description":"Path used to select a filesystem","required":false,"variadic":false}],"flags":[],"requires_root":false,"requires_force":false,"supports_dry_run":false,"requires_confirmation":false}]}
