{"protocol_version":1,"name":"system-base","version":"1.0.1","description":"Operating system information and health diagnostics for ohtools.","commands":[{"path":["system","info"],"use":"info","short":"Show operating system information","category":"diagnostic","arguments":[],"flags":[],"requires_root":false,"requires_force":false,"supports_dry_run":false,"requires_confirmation":false},{"path":["system","health"],"use":"health","short":"Run operating system health checks","category":"diagnostic","arguments":[],"flags":[],"requires_root":false,"requires_force":false,"supports_dry_run":false,"requires_confirmation":false}]}
